{
  "initials": "R.M.",
  "first_name": "Richard",
  "last_name": "Michaud",

  "title_fr": "Consultant Senior — Risk & Regulatory",
  "title_en": "Senior Consultant — Risk & Regulatory",
  "domain_fr": "Banque & CIB — Transformation réglementaire",
  "domain_en": "Banking & CIB — Regulatory Transformation",

  "fr": {
    "summary": "",
    "expertise": [
      "Risk & Regulatory",
      "Transformation bancaire (CIB / Retail)",
      "Modèles IRB & Risque de crédit",
      "CRR 3 — Recovery & Resolution",
      "Gouvernance des risques digitaux (AI Act)"
    ],
    "languages": [
      { "name": "Français", "level": "Langue maternelle" },
      { "name": "Anglais",  "level": "Courant" },
      { "name": "Espagnol", "level": "Bases" }
    ],
    "education": [
      { "year": "2016 — 2017", "school": "Paris 1 Panthéon-Sorbonne", "degree": "Master 2 Banque Finance" },
      { "year": "2013 — 2016", "school": "Bordeaux / Tampere", "degree": "Magistère d'Économie & Finance Internationales" },
      { "year": "—", "school": "Certifications", "degree": "AMF, AMF-ARPP" }
    ],
    "experiences": [
      {
        "employer": "Inside (Inside Circle, Inside Banking, Inside Training)",
        "role": "Fondateur — Consultant indépendant",
        "duration": "Depuis Jan. 26",
        "achievements": [
          "Inside Circle : collectif de +30 freelances du secteur financier (banque, assurance, AM) ; Inside Banking : média leader (4M vues / 12 mois, podcast n°1 en France +70K écoutes, newsletter +14K abonnés).",
          "Inside Training : organisme de formation new gen — éducation financière B2B, marque blanche et Personal Branding pour dirigeants."
        ]
      },
      {
        "employer": "EY",
        "role": "Senior Consultant → Senior Manager",
        "duration": "Oct. 19 — Déc. 25",
        "achievements": [
          "Refonte du processus de rating interne des contreparties (7 ETP) ; déploiement de modèles IRB dans le cadre d'un rachat de portefeuille (TOM, superviseur, infrastructure IT/Data).",
          "Pilotage de projets « risques digitaux » pour une G-SIB : mise en conformité EU AI Act ; référent Risk & Regulatory pour 2 comptes prioritaires (G-SIB françaises)."
        ]
      },
      {
        "employer": "PwC",
        "role": "Consultant Financial Services",
        "duration": "Sept. 17 — Oct. 19",
        "achievements": [
          "Projets réglementaires pour une G-SIB française (périmètre CIB) : coordination d'une certification auprès du régulateur US (10 entités).",
          "Élaboration de formations réglementaires déployées auprès de +8 000 collaborateurs."
        ]
      },
      {
        "employer": "Mazars",
        "role": "Consultant Financial Services",
        "duration": "Avril — Sept. 17",
        "achievements": [
          "Définition et rédaction d'un Plan Préventif de Rétablissement (PPR) pour un groupe bancaire étranger : analyse stratégique, options de redressement, stress tests, gouvernance."
        ]
      }
    ],
    "references": [
      "EY", "PwC", "Mazars", "Banque Populaire (BPACA)"
    ],
    "engagements": [
      { "title": "Auteur",             "description": "Lettre réglementaire banque EY France" },
      { "title": "Création de contenu", "description": "Podcast & newsletter financiers" }
    ],
    "hobbies": [
      "Entrepreneuriat",
      "Création de contenu",
      "Running",
      "Tennis"
    ]
  },

  "en": {
    "summary": "",
    "expertise": [
      "Risk & Regulatory",
      "Banking Transformation (CIB / Retail)",
      "IRB Models & Credit Risk",
      "CRR 3 — Recovery & Resolution",
      "Digital Risk Governance (EU AI Act)"
    ],
    "languages": [
      { "name": "French",  "level": "Native" },
      { "name": "English", "level": "Fluent" },
      { "name": "Spanish", "level": "Basic" }
    ],
    "education": [
      { "year": "2016 — 2017", "school": "Paris 1 Panthéon-Sorbonne", "degree": "Master's in Banking & Finance" },
      { "year": "2013 — 2016", "school": "Bordeaux / Tampere", "degree": "Magistère in Economics & International Finance" },
      { "year": "—", "school": "Certifications", "degree": "AMF, AMF-ARPP" }
    ],
    "experiences": [
      {
        "employer": "Inside (Inside Circle, Inside Banking, Inside Training)",
        "role": "Founder — Independent Consultant",
        "duration": "Since Jan. 26",
        "achievements": [
          "Inside Circle: community of 30+ financial-sector freelances (banking, insurance, AM); Inside Banking: leading media (4M views / 12 months, France's #1 banking podcast +70K listens, newsletter +14K subscribers).",
          "Inside Training: new-gen training organisation — B2B financial education, white-label content and Personal Branding for executives."
        ]
      },
      {
        "employer": "EY",
        "role": "Senior Consultant → Senior Manager",
        "duration": "Oct. 19 — Dec. 25",
        "achievements": [
          "Redesign of the internal counterparty rating process (7 FTE); IRB credit-model rollout for a portfolio acquisition (TOM, supervisor, IT/Data infrastructure).",
          "Lead of digital-risk projects for a G-SIB: EU AI Act compliance; Risk & Regulatory referent for 2 priority accounts (French G-SIBs)."
        ]
      },
      {
        "employer": "PwC",
        "role": "Consultant Financial Services",
        "duration": "Sept. 17 — Oct. 19",
        "achievements": [
          "Regulatory projects for a French G-SIB (CIB scope): coordination of a US-regulator certification (10 entities).",
          "Design of regulatory training rolled out to 8,000+ employees."
        ]
      },
      {
        "employer": "Mazars",
        "role": "Consultant Financial Services",
        "duration": "April — Sept. 17",
        "achievements": [
          "Drafting of a Preventive Recovery Plan (PPR) for a foreign banking group: strategic analysis, recovery options, stress tests, governance."
        ]
      }
    ],
    "references": [
      "EY", "PwC", "Mazars", "Banque Populaire (BPACA)"
    ],
    "engagements": [
      { "title": "Author",          "description": "EY France banking regulatory newsletter" },
      { "title": "Content creator",  "description": "Financial podcast & newsletter" }
    ],
    "hobbies": [
      "Entrepreneurship",
      "Content creation",
      "Running",
      "Tennis"
    ]
  }
}
